#,Channel Name,Handle,Country,Subscribers,Total Views,Videos,Bio
1,MR. INDIAN HACKER,@mrindianhacker,IN,51400000,10354537820,1348,"""MR. INDIAN HACKER""  This channel is only for you guys All Subscribers are my family also called ""TITANIUM ARMY"" You can join us by subscribing   Thanks for visit  ""LOVE YOU ALL""  For business enquiries contact us at -    team@mrindianhacker.com   "
2,DEV Ke Experiment,@devkeexperiment,,21100000,12713144844,1165,"❤️‍🔥Welcome ❤️‍🔥  For Business Enquiry Only:-  Devkeofficial@gmail.com . . . . Tags:- Science,Magic,Experiment,Fun,Education,Diy #devkefacts #devkeshorts  #devkevlogs #devkeexperiment "
3,chatpat toy tv,@chatpattoytv,IN,10100000,3675533764,2029,"CHATPAT TOY TV CHANNEL WHERE YOU CAN FIND UNBOXING & TESTING VIDEOS OF RC CARS, RC DRONES, RC BIKES, RC QUADCOPTER, HOBBY CARS,EXPERIMENT KITS, CODING KITS, AI LEARNING KIT, SCIENCE PROJECTS, & SMART GADGETS.   For Business/Sponsorship  : chatpattoytv@gmail.com"
4,RCDriftTok,@rcdrifttok,GB,6970000,9813570069,1160,"RC cars, drifting, stunts and other cool stuff! Buy the RC cars I use at RCDriftTok.com"
5,AndreoBee,@andreobee,IN,6330000,1538722506,697,Managed by OP Gaming  
6,Tech Boss,@techbossindia,IN,5170000,2452884441,2175,"Welcome to Tech Boss, your ultimate source for the latest in mobile phones, apps, automobiles, and cutting-edge gadgets. We provide comprehensive and engaging content, including reviews, comparisons, tutorials, and tech hacks, all designed to keep you informed and ahead of the curve. With over 7 mil"
7,Shamshad Maker,@shamshadmaker,IN,4900000,1411103871,478,It's all about RC hobbies.. Here you will find all kinds of RC Toys Unboxing & Testing videos.. Please Support us to get all kind of RC Stuff to film on my YouTube channel..  For Business/Sponsorship  Email: shamshadvideo@gmail.com   Thanks for watching!! Have a nice day!! 
8,Gajuraa,@gajuraa01,IN,4550000,2790068152,1016,Soon Nibu nichodam Tand Paaa   Business— officialgajura@gmail.com  
9,Beebom,@beebomco,IN,3530000,1719698212,2029,Beebom's official YouTube Channel. 
10,Smart Toy’s Capture,@smarttoyscapture,IN,3320000,6210030467,1408,Welcome to Anam Shorts🥰  Sponsorship | collaboration | promotion👍   for business inquiries👇👇 Danishlaskar801145@gmail.com 
11,HACKER JP,@hackerjp,IN,3000000,1074622665,339,"नमस्ते दोस्तों, In this Channel you will find absolutely stunning video related to Robotics,  Life Hacks ,  DIY Projects,  uncountable Electronic Projects and science experiments.  Hii guys welcome to Hacker JP YouTube channel. My name is Jayprakash Banjare I am from India 🇮🇳  दोस्तों इज चैनल पर आपक"
12,AuthenTech - Ben Schmanke,@authentech,US,2700000,4221822742,1231,"Authentic reviews of Tech = AuthenTech. Exploring innovative and exciting technology.   Business inquiries: yt @ authen.tech   == What is the meaning behind AuthenTech? -Life is congruent with what you believe. -I'm a Christian and my faith is at the center of everything I do. -My hope, joy, and ide"
13,Freddy Collector ,@freddytoys,US,2530000,1367427006,786,Experience Collector. 🇺🇦🇩🇪🇺🇸  https://www.instagram.com/freddy_toys/ https://www.tiktok.com/@freddytoys  www.linktr.ee/freddycollector  
14,MrRohitt2.0,@mrrohitt2.0,IN,1990000,473421075,303,Business Enquiry & Sponsorship $ Email Me- business@shrotegly.com 
15,Tech Satire,@techsatire,IN,1570000,650753960,2059,Useful & Interesting Tech Videos!  Business Enquiries : technologysatire@gmail.com   Facebook: Tech Satire Instagram: techsatire 
16,Rc Warrior,@rcwarrior0327,IN,1280000,546554140,126,"RC Warrior – More Than Just Remote Control Welcome to RC Warrior, where imagination meets innovation! This is not just about RC cars — it's about creating joy, sparking curiosity, and making everyday moments unforgettable.  Watch our unique RC vehicles do the unexpected: from buying beach snacks to "
17,JMV TOYS,@jmvtoys,IN,958000,1262852370,2120,"we are providing toys unboxing videos in our youtube channel.please like,share and subscribe my youtube channel.not for kids.my video is not made for kids. "
18,Peephole View Toys,@peepholeview,IN,845000,94220222,330,"Hi Friends Welcome here at ""  Peephole view""   Friends, Aap sab k liye yaha par mai laya hu Toys, Games, Experiment Kit,DIY Kit, STEM Kit, Gadgets Unboxing/Test/Review  in Hindi. Yaha par apko dekhne ko milenge har tarah ke toys & games, Educational kit ki videos.  Subscribe for latest Update   Keep"
19,Sanu Tech,@sanutech,IN,824000,280416835,895,"Hello friends    Welcome to my channel - Sanu Tech - here, you will learn life tools, experiment, how to make, what how, a lot of information related to smartphone tech and much more.    And don't forget to subscribe channel for new update     Thanks for visiting and watching 😊😊😊😊"
20,Happy Here Films,@happyherefilms,IN,779000,438300236,188,"Never let your inner child die ❤️  To order RC cars in India,   https://www.bharathobby.com  Or whatsapp - 877-9521387   Instagram- @Himanshu_ptel  Whatsapp Channel for updates- https://whatsapp.com/channel/0029Va90M8Q7T8bfluvDfK0w  Email- connecthimanshupatel@gmail.com"
21,DADDY DRONES,@daddydrones,IN,569000,190296796,1305,"Daddy Drones is India’s #1 Drone & RC Hobby Store, based in Mumbai and trusted by hobbyists across India. We offer drones, RC cars, crawlers, boats, planes, and hobby collectibles for beginners and pros.  Our mission is to make high-quality RC gear accessible and affordable with expert guidance, dem"
22,RC Play Ground,@rcplayground,KR,382000,132484237,2349,RC CAR Channel  E-Mail : sagoru@naver.com               sagoru@hanmail.net
23,rcxrides,@rcxrides,IN,371000,239295022,173,"Welcome to rcxrides – where speed meets adventure and dogs get snacks delivered on wheels! 🐶🚙  On this channel, you’ll find a wild mix of:  RC Car shopping, Public reactions, Street rides  🚗 RC Car Action – Adventures,high-speed runs, jumps, stunts & DIY mods  🐕 Dog Feeding with RC Cars – fun, creat"
24,Redkash Shorts,@redkashshorts,IN,315000,307862983,768,Welcome to Redkash Shorts.. 👋
25,Crazy Tech Raunak,@crazytechraunak,IN,287000,122760624,604,"Hello Friends Welcome To Our Channel Crazy Tech Raunak. Friends This Channel Is For Science Experiments, Crazy Explosive Videos And A Little Bit Of Technology Videos.  So Make Sure To Subscribe This Channel For These Kinds Of Videos.  You Will Be Always Impress by Our Kamal-Dhamal-Dhamakedar Content"
26,CHUNGG ANHH,@chungganhh99,VN,213000,454918806,381," Welcome to CHUNGG ANHH Channel!   This is a channel all about RC cars, trucks, helicopters, airplanes, and jets! We bring you epic RC battles, off-road adventures, hill climbs, terrain tests, and speed challenges with every kind of remote-controlled machine.   From RC rock crawlers and monster truc"
27,Rajib Toy,@rajibtoy,IN,153000,311459577,886,😍1M Family Coming soon 😍🥰       🥺Please subscribe now 🥺👈🏻
28,i techsearch,@itechsearch,IN,149000,23064900,590,"Hello Guys   i techsearch | COOL GADGETS| HITECH GADGETS | NEW TECHNOLOGY | FUTURISTIC TECHNOLOGY | GADGETS FOR SMARTPHONE | AMAZING GADGETS | FUTURISTIC GADGETS | DIY GADGETS |TECHNOLOGY EXPLAIN & MUCH MORE.  Top 5 Cool Gadgets Review, Gadget Unboxing, Smartphone Unboxing, And Science and Technolog"
29,Dilbar Ke Toys,@dilbar_ke_toys,IN,141000,399253448,1948,"👋Welcome to dilbar ke toys👋         🙏🥺Please subscribe🥺   Copyright Disclaimer ÷ This video is only entertainment purposes copyright disclaimer under section 107 of the copyright act 1976. allowance is made for x""fair usex""for purposes sach as music, comment, news, reporting, teaching, scholarship. "
30,haike Toys,@haiketoys,VN,120000,298792189,677,"hello, welcom to TiTi Cars, this channel is about diecast cars, model cars and toys cars, Racing cars..on this channel you will find variout miniature of cars , small models, collectors cars, different cars sets and individu models,dieacast model cars from the box,cars in the box, box of cars, cars "
31,Ayaan RC Toys ,@ayaanrctoys,IN,107000,54734105,329,"200K coming  Hello Everyone! Welcome to Ayaan RC Toys, where we bring you the coolest and most exciting remote-control toys! From cars to drones, we test and review the latest in RC technology. If you love toys and gadgets that are fun, fast, and full of surprises, you’re in the right place!  Don’t "
32,Mr Original,@mr_origiinal,,81100,92273523,417,maybe we have your car.
33,Unbox & Roll,@unbox_and_roll,IN,71400,66402560,495,"Welcome to Unbox And Roll!  Unbox. Review. Laugh. Repeat.  From RC cars zooming past at full speed to gadgets You didn’t know you needed, this is the place for epic Unboxings, funny reviews, and total tech madness!  Expect: ✅ RC Car Unboxings & Mini Test Drives ✅ Cool & Weird Electronic Gadget Revie"
34,Desi RC Garage,@desircgarage,,70900,13723168,235,"🚗 Welcome to the Desi RC Garage Universe! 🏁 Are you obsessed with RC cars, remote control trucks, RC drift cars, or nitro-powered beasts? You’ve just found your new favorite pit stop! This channel is your go-to destination for everything remote control car related—from RC racing and off-road RC adve"
35,AirToGround RCFPV,@airtogroundrcfpv,,43600,33893491,158,"Multirotor and Drone enthusiast with a passion for FPV and all things RC. Lately I've been hooked on building and drifting Mini RC Cars of different scale sizes. I have 13 years of experience flying, tuning and building drones from scratch and love throwing FPV (First Person View) into everything. I"
36,Hobby Central,@hobbycentralindia,IN,39500,23680330,408,"R/C Planes . Helis . Monster Trucks . Buggy . Planes .Boats  Products / Activities / Adventures Hobby Central Is A Comprehensive Hobby Store That Deals In Exclusive R/C Toys. Founded In 2008, Hobby Central Is Perhaps, The Most Trusted And Recommended Name Among R/C Enthusiasts.  With An In-House Ser"
37,Vishal Creator ,@vishalcreator19,IN,37900,32322200,525,Hello Dear Friends 🙋  Welcome To Our YouTube Channel ( Vishal Creator )   Here You Will Find A Lot Of Variety Of Videos And Shorts   Thank U So Much For Your Love And Support ❤️❤️  If You Like My Videos Don't Forget Like And Subscribe Button   For Business -  aahan9799@gmail.com  
38,Unboxer Pintu Yadav,@unboxerpintu,IN,37200,16877963,291,👇 Follow me on Instagram 👇   more information & any bussiness inquiry/ Sponsorship:-  Email - ppiinnttuu7468@gmail.com
39,Do U RC 2,@dourc2,GB,35100,47166777,458,"Welcome to Do U RC 2  My Second Channel for Shorts, Budget Reviews, Crawlers, Channel Updates and More.   ⬇️ WIN RC's, Discounts & More ⬇️ Use the Links Below. "
40,The Branded Artist,@21brandedboy,IN,22700,28115416,385,"I showcase my life’s journey and unboxing brands and tools I love & use. Also I ❤️ Watches and Hobby Grade RC cars,  so I have some crazy content to share here 😆  Hi, My name is Jason  also known as “The Branded Artist”  from Mumbai.  ✨ I am an Artist who Admire Brands ✨  I have been tattooing profe"
41,WAN KREATIF,@wankreatif,ID,17900,5932306,491,Mau beli RC keren rekomendasi WAN KREATIF klik link di bawah             
42,RCgasm,@rcgasm,ID,16000,10460577,1251,"Selamat datang di RCgasm — Destinasi Wajib para penggemar RC! RCgasm adalah komunitas bagi kalian yang jatuh cinta pada kecepatan, ketangguhan, dan detail dari sebuah RC. Kami mendedikasikan diri untuk menyajikan konten berkualitas tinggi seputar dunia Remote Control.   Tonton video-video terbaru ka"
43,Karthikeyan Stores,@karthikeyanstores1349,IN,14800,7002716,410,"The Way Of Imported Toys 🪀🧸 Thanks for visiting  Karthikeyanstores ❤️. We are selling latest collection of gift items ✨ 1. Wall Clocks, ⏰ 2. LED Copuls Photo Frames, 🖼️ 3. Teddy Bears, 🧸 4. Copuls Statues, statue 🗽 5. Lamps, 🛋️ 6. Birthday Gifts, 🎁 7. Wedding Gifts, 💕 8. Love Anniversary Gifts, 😘 9."
44,Game 3D King,@game3dking,IN,11900,15166762,664,"WellCome To “Game 3D King”  This Channel Is Dedicated To RC Cars, RC Monster Trucks, and RC Rock Crawlers.  Here You Will Watch Power-Packed RC Car Videos Including   RC Car Unboxing & First Look RC Car Testing & Reviews Tug of War Power Tests Uphill Climbing & Off-Road Challenges Mud, Rock & Extrem"
45,RC Drifterss,@rcdrifterss,,9510,8718155,249,Get Your Drifting Porsche for 50% OFF! ❤️
46,Horizon The Hobby Store,@horizonthehobbystore,,9380,1370294,83,"Official Channel of Horizon The Hobby Store Sri Lanka  Unleash the Thrill! Sri Lanka’s Best RC Hobby Shop is Here!😎   Wide Range of Premium RC Cars, Drones, Boats , Airplane, Helicopters & Accessories  ✔ Buy Authentic Products from Authorized Dealer in 🇱🇰 Horizon ✔ With Horizon Care Guarantee🛡️ ✔ Sp"
47,TechSpac3,@techspac3,NZ,8230,3518451,661,"Unboxing, Setup and Reviews of Tech and Big Boy Toys. I love RC Cars and the main focus of this channel is RC. This channel is here for fun and enjoyment. Hopefully some helpful info as well.  For any Enquiries!? Use the email below! "
48,8BitToast,@its8bittoast,IN,7700,4007664,187,"Tech, Done Right! "
49,RC Turbo Garage,@rc_turbo_garage,US,5530,1939962,243,"  Welcome to my channel! Here you’ll find the coolest toy cars and RC models. We unbox, test, race, and have fun with all kinds of vehicles! Enjoy exciting short videos full of speed, action, and great moments. Subscribe and never miss the latest toy car adventures! "
50,Tygatec Racing – Hobby Grade RC Cars India,@tygatec,IN,5160,5547946,129,"🏁 Tygatec – India’s Fastest Hobby-Grade RC Cars We don’t just sell RC cars — we build them from scratch. As a proud Indian brand, Tygatec engineers high-performance, hobby-grade RC cars for adults and kids — built for real speed, strength & durability.  Our best-seller, Tygatec Supersonic, is India’"
51,DION's Diecast,@diondiecast,,1900,1286735,14,"Welcome to Dion's Diecast – The Ultimate Diecast Car Garage! 🏁🚗  Rev up your passion for scale models! Here, we explore the world of diecast car collecting with cinematic showcases, unboxings, rare finds, brand comparisons, custom builds, and more. Whether you're a long-time collector or just starti"
52,BestBuyBoxes,@bestbuyboxes,,1750,1139310,225,www.bestbuyboxes.com Drone Racing | FPV | RC Cars | RC Planes | RC Helicopters | Quadcopters 
53,MRC HOBBIES,@mrchobbies,IN,1230,636148,186,We are Radio Controlled car Racers from INDIA. We aim to spread this supper amazing sports to all over INDIA. We are among the best Drivers in INDIA. We also provide guidance for buying and maintaining similar cars.  We are also Create Travel Content Along with our RC hobby Videos  Follow us on - ww
